1;Classical Mythology;Mark P. O. Morford;2002;Oxford University Press
2;Clara Callan;Richard Bruce Wright;2001;HarperFlamingo Canada
3;Decision in Normandy;Carlo D'Este;1991;HarperPerennial
4;Flu: The Story of the Great Influenza Pandemic of 1918 and the Search for the Virus That Caused It;Gina Bari Kolata;1999;Farrar Straus Giroux
5;The Mummies of Urumchi;E. J. W. Barber;1999;W. W. Norton  Company
6;The Kitchen God's Wife;Amy Tan;1991;Putnam Pub Group
7;What If?: The World's Foremost Military Historians Imagine What Might Have Been;Robert Cowley;2000;Berkley Publishing Group
8;PLEADING GUILTY;Scott Turow;1993;Audioworks
9;Under the Black Flag: The Romance and the Reality of Life Among the Pirates;David Cordingly;1996;Random House
10;Where You'll Find Me: And Other Stories;Ann Beattie;2002;Scribner
11;Nights Below Station Street;David Adams Richards;1988;Emblem Editions
12;Hitler's Secret Bankers: The Myth of Swiss Neutrality During the Holocaust;Adam Lebor;2000;Citadel Press
13;The Middle Stories;Sheila Heti;2004;House of Anansi Press
14;Jane Doe;R. J. Kaiser;1999;Mira Books
15;A Second Chicken Soup for the Woman's Soul (Chicken Soup for the Soul Series);Jack Canfield;1998;Health Communications
16;The Witchfinder (Amos Walker Mystery Series);Loren D. Estleman;1998;Brilliance Audio - Trade
17;More Cunning Than Man: A Social History of Rats and Man;Robert Hendrickson;1999;Kensington Publishing Corp.
18;Goodbye to the Buttermilk Sky;Julia Oliver;1994;River City Pub
19;The Testament;John Grisham;1999;Dell
20;Beloved (Plume Contemporary Fiction);Toni Morrison;1994;Plume
21;Our Dumb Century: The Onion Presents 100 Years of Headlines from America's Finest News Source;The Onion;1999;Three Rivers Press
22;New Vegetarian: Bold and Beautiful Recipes for Every Occasion;Celia Brooks Brown;2001;Ryland Peters  Small Ltd
23;If I'd Known Then What I Know Now: Why Not Learn from the Mistakes of Others? : You Can't Afford to Make Them All Yourself;J. R. Parrish;2003;Cypress House
24;Mary-Kate  Ashley Switching Goals (Mary-Kate and Ashley Starring in);Mary-Kate  Ashley Olsen;2000;HarperEntertainment
25;Tell Me This Isn't Happening;Robynn Clairday;1999;Scholastic
26;Flood : Mississippi 1927;Kathleen Duey;1998;Aladdin
27;Wild Animus;Rich Shapero;2004;Too Far
28;Airframe;Michael Crichton;1997;Ballantine Books
29;Timeline;MICHAEL CRICHTON;2000;Ballantine Books
30;OUT OF THE SILENT PLANET;C.S. Lewis;1996;Scribner
31;Prague : A Novel;ARTHUR PHILLIPS;2003;Random House Trade Paperbacks
32;Chocolate Jesus;Stephan Jaramillo;1998;Berkley Publishing Group
33;Wie Barney es sieht.;Mordecai Richler;2002;L√?¬ºbbe
34;Der Fluch der Kaiserin. Ein Richter- Di- Roman.;Eleanor Cooney;2001;Goldmann
35;Sturmzeit. Roman.;Charlotte Link;1991;Goldmann
36;Tage der Unschuld.;Richard North Patterson;2000;Goldmann
37;Lying Awake;Mark Salzman;2000;Alfred A. Knopf
38;To Kill a Mockingbird;Harper Lee;1988;Little Brown  Company
39;Seabiscuit: An American Legend;LAURA HILLENBRAND;2002;Ballantine Books
40;Pigs in Heaven;Barbara Kingsolver;1993;Harpercollins
41;Miss Zukas and the Raven's Dance;Jo Dereske;1996;Avon
42;Pride and Prejudice;Jane Austen;1983;Bantam
43;The Therapeutic Touch: How to Use Your Hands to Help or to Heal;Dolores Krieger;1979;Fireside
44;Downtown;Anne Rivers Siddons;1995;HarperTorch
45;Icebound;Dean R. Koontz;2000;Bantam Books
46;I'll Be Seeing You;Mary Higgins Clark;1994;Pocket
47;From the Corner of His Eye;Dean Koontz;2001;Bantam Books
48;Isle of Dogs;Patricia Cornwell;2002;Berkley Publishing Group
49;Purity in Death;J.D. Robb;2002;Berkley Publishing Group
50;This Year It Will Be Different: And Other Stories;Maeve Binchy;1997;Dell
51;Proxies;Laura J. Mixon;1999;Tor Books
52;Left Behind: A Novel of the Earth's Last Days (Left Behind #1);Tim Lahaye;2000;Tyndale House Publishers
53;The Street Lawyer;JOHN GRISHAM;1999;Dell
54;Love, Medicine and Miracles;M.D. Bernie S. Siegel;1988;HarperCollins Publishers
55;All the King's Men;Robert Penn Warren;1982;Harvest Books
56;Pacific Northwest;Hans Johannes Hoefer;1985;Chambers Harrap Publishers Ltd
57;A Soldier of the Great War;Mark Helprin;1992;Avon Books
58;Getting Well Again;O. Carol Simonton Md;1992;Bantam
59;Northwest Wines and Wineries;Chuck Hill;1993;Speed Graphics
60;An Atmosphere of Eternity: Stories of India;David Iglehart;2002;Sunflower Press
61;LONESOME DOVE;Larry McMurtry;1986;Pocket
62;Shabanu: Daughter of the Wind (Border Trilogy);SUZANNE FISHER STAPLES;1991;Laurel Leaf
63;Haveli (Laurel Leaf Books);SUZANNE FISHER STAPLES;1995;Laurel Leaf
64;Lieux dits;Michel Tournier;2002;Gallimard
65;The Dragons of Eden: Speculations on the Evolution of Human Intelligence;Carl Sagan;1978;Ballantine Books
66;The yawning heights;Aleksandr Zinoviev;1980;Random House
67;Breathing Lessons;Anne Tyler;1994;Berkley Publishing Group
68;The Joy Luck Club;Amy Tan;1994;Prentice Hall (K-12)
69;Heart of Darkness (Wordsworth Collection);Joseph Conrad;1998;NTC/Contemporary Publishing Company
70;The Angel Is Near;Deepak Chopra;2000;St. Martin's Press
71;Tess of the D'Urbervilles (Wordsworth Classics);Thomas Hardy;1997;NTC/Contemporary Publishing Company
72;The Adventures of Drew and Ellie: The Magical Dress;Charles Noland;2003;1stBooks Library
73;The Accidental Virgin;Valerie Frankel;2003;Avon Trade
74;The Tao of Pooh;Benjamin Hoff;1983;Penguin Books
75;Seabiscuit;LAURA HILLENBRAND;2003;Ballantine Books
76;The Prince;Niccolo Machiavelli;1952;Signet Book
77;Life's Little Instruction Book (Life's Little Instruction Books (Paperback));H. Jackson Brown;1991;Thomas Nelson
78;Starship Troopers;Robert A. Heinlein;1987;Ace Books
79;The Ruby in the Smoke (Sally Lockhart Trilogy, Book 1);PHILIP PULLMAN;1988;Laurel Leaf
80;Black Beauty (Illustrated Classics);Anna Sewell;1995;Landoll
81;Anil's Ghost;MICHAEL ONDAATJE;2000;Knopf
82;Prescription for Terror;Sandra Levy Ceren;1999;Andrew Scott Publishers
83;Modern Manners: An Etiquette Book for Rude People;P.J. O'Rourke;1990;Atlantic Monthly Press
84;Turning Thirty;Mike Gayle;2000;Hodder  Stoughton General Division
85;Decipher;Stel Pavlou;2002;Simon  Schuster (Trade Division)
86;My First Cousin Once Removed: Money, Madness, and the Family of Robert Lowell;Sarah Payne Stuart;1999;Perennial
87;Standing Firm: A Vice-Presidential Memoir;Dan Quayle;1994;Harpercollins
88;Team Bush : Leadership Lessons from the Bush White House;Donald F. Kettl;2003;McGraw-Hill
89;The Right Man : The Surprise Presidency of George W. Bush;DAVID FRUM;2003;Random House
90;Daybreakers Louis Lamour Collection;Louis Lamour;1981;Bantam Doubleday Dell
91;The Catcher in the Rye;J.D. Salinger;1991;Little, Brown
92;El Senor De Los Anillos: LA Comunidad Del Anillo (Lord of the Rings (Spanish));J. R. R. Tolkien;2001;Minotauro
93;El Senor De Los Anillos: Las DOS Torres (Lord of the Rings (Paperback));J. R. R. Tolkien;2001;Minotauro
94;El Senor De Los Anillos: El Retorno Del Rey (Tolkien, J. R. R. Lord of the Rings. 3.);J. R. R. Tolkien;2001;Distribooks
95;Midnight in the Garden of Good and Evil: A Savannah Story;John Berendt;1994;Random House
96;Pretend You Don't See Her;Mary Higgins Clark;1998;Pocket
97;Fast Women;Jennifer Crusie;2001;St. Martin's Press
98;Female Intelligence;Jane Heller;2001;St. Martin's Press
99;Pasquale's Nose: Idle Days in an Italian Town;Michael Rips;2002;Back Bay Books
100;The Gospel of Judas: A Novel;Simon Mawer;2002;Back Bay Books
101;Prize Stories, 1987: The O'Henry Awards;William Abrahams;1987;Doubleday Books
102;Rich Dad, Poor Dad: What the Rich Teach Their Kids About Money--That the Poor and Middle Class Do Not!;Robert T. Kiyosaki;2000;Warner Books
103;The Pillars of the Earth;Ken Follett;1996;Signet Book
104;McDonald's: Behind the Arches;John F. Love;1995;Bantam
105;Creating Wealth : Retire in Ten Years Using Allen's Seven Principles of Wealth!;Robert G. Allen;1986;Fireside
106;Corelli's Mandolin : A Novel;LOUIS DE BERNIERES;1995;Vintage
107;Love, Miracles, and Animal Healing : A heartwarming look at the spiritual bond between animals and humans;Pam Proctor;1996;Fireside
108;The Five People You Meet in Heaven;Mitch Albom;2003;Hyperion
109;Tu Nombre Escrito En El Agua (La Sonrisa Vertical);Irene Gonzalez Frei;2002;Tusquets
110;Relics (Star Trek: The Next Generation);Michael Jan Friedman;1992;Star Trek
111;Bless The Beasts And Children : Bless The Beasts And Children;Glendon Swarthout;1995;Pocket
112;The Touch of Your Shadow, the Whisper of Your Name (Babylon 5, Book 5);Neal Barrett Jr.;1996;Dell
113;Blood Oath;David Morrell;1994;St. Martin's Press
114;The Alibi;Sandra Brown;2000;Warner Books
115;The Beach House;James Patterson;2003;Warner Books
116;A Kiss Remembered;Sandra Brown;2003;Warner Books
117;The Short Forever;Stuart Woods;2003;Signet Book
118;Dead Aim;IRIS JOHANSEN;2004;Bantam Books
119;Angels  Demons;Dan Brown;2001;Pocket Star
120;The Deal;Joe Hutsko;2000;Tor Books (Mm)
121;All He Ever Wanted: A Novel;Anita Shreve;2004;Back Bay Books
122;Every Breath You Take : A True Story of Obsession, Revenge, and Murder;Ann Rule;2002;Pocket
123;If I Ever Get Back to Georgia, I'm Gonna Nail My Feet to the Ground;LEWIS GRIZZARD;1991;Ballantine Books
124;The Mosquito Coast;Paul Theroux;1990;Harper Mass Market Paperbacks (Mm)
125;If Love Were Oil, I'd Be About a Quart Low;Lewis Grizzard;1994;Warner Books (Mm)
126;Goodbye, My Little Ones: The True Story of a Murderous Mother and Five Innocent Victims;Charles Hickey;1996;Onyx Books
127;The Girl Who Loved Tom Gordon;Stephen King;2000;Pocket
128;Bringing Down the House: The Inside Story of Six M.I.T. Students Who Took Vegas for Millions;Ben Mezrich;2003;Free Press
129;The Oneprince (The Redaemian Chronicles, Book 1);Bill Hand;1992;Thomas Nelson Inc
130;The Sum of All Fears;Tom Clancy;2002;Berkley Publishing Group
131;Care Packages : Letters to Christopher Reeve from Strangers and Other Friends;DANA REEVE;1999;Random House
132;O Deus Das Pequenas Coisas;Roy;1998;Edicoes Asa
133;Lady in Green/Minor Indiscretions (Signet Regency Romance);Barbara Metzger;2002;Signet Book
134;One Hundred Years of Solitude;Gabriel Garcia Marquez;1998;Perennial
135;Little Altars Everywhere: A Novel;Rebecca Wells;1996;Perennial
136;Coyote Waits (Joe Leaphorn/Jim Chee Novels);Tony Hillerman;1992;HarperTorch
137;Before I Say Good-Bye;Mary Higgins Clark;2001;Pocket
138;Slow Waltz in Cedar Bend;Robert James Waller;1994;Warner Books
139;Twenty Minute Retreats: Revive Your Spirits in Just Minutes a Day (A Pan Self-discovery Title);Rachel Harris;2001;Pan Macmillan
140;Atonement : A Novel;IAN MCEWAN;2003;Anchor
141;Next: The Future Just Happened;Michael Lewis;2001;W.W. Norton  Company
142;The Angelic Darkness;Richard Zimler;1999;Arcadia Books
143;The Soulbane Stratagem;Norman Jetmundsen;2000;John Hunt Publishing, Ltd.
144;Gangster;Lorenzo Carcaterra;2002;Fawcett Books
145;Hush;Anne Frasier;2002;Onyx Books
146;Whisper of Evil (Hooper, Kay. Evil Trilogy.);Kay Hooper;2002;Bantam Books
147;Temor y Temblor;Soren Kierkegaard;2001;Alianza
148;Estudios sobre el amor;Jose Ortega Y Gaset;2001;Downtown Book Center
149;Rebecca;Daphne Du Maurier;1994;Avon
150;Scarlet Letter;Nathaniel Hawthorne;1993;Signet Book
151;Keep It Simple: And Get More Out of Life;Nick Page;1999;Trafalgar Square
152;Diary of a Mad Mom-To-Be;Laura Wolf;2003;Delta
153;Locked in Time (Laurel Leaf Books);LOIS DUNCAN;1986;Laure Leaf
154;Contact;Susan Grant;2002;Love Spell
155;The Brimstone Wedding;Barbara Vine;1997;Penguin Books Ltd
156;The Catswold Portal;Shirley Rousseau Murphy;1993;Roc
157;Through Wolf's Eyes (Wolf);Jane Lindskold;2002;Tor Fantasy
158;Puerto Vallarta Squeeze;Robert James Waller;1995;Warner Books
159;Tree Grows In Brooklyn;Betty Smith;1988;Harpercollins Publisher
160;Cybill Disobedience: How I Survived Beauty Pageants, Elvis, Sex, Bruce Willis, Lies, Marriage, Motherhood, Hollywood, and the Irrepressible Urge to Say What I Think;Cybill Shepherd;2001;Avon Books
161;Snow Angels;Stewart O'Nan;1995;Penguin Books
162;Wish You Well;David Baldacci;2000;Warner Books
163;The Hitchhiker's Guide to the Galaxy;Douglas Adams;1982;Pocket
164;Crow Lake (Today Show Book Club #7);Mary Lawson;2003;Delta
165;My Antonia;Willa Cather;1995;Mariner Books
166;Pen Pals;Olivia Goldsmith;2002;Signet Book
167;Bridget Jones's Diary;Helen Fielding;1997;Picador (UK)
168;Pride and Prejudice (Dover Thrift Editions);Jane Austen;1995;Dover Publications
169;EYE ON CRIME: HARDY BOYS #153;Franklin W. Dixon;1998;Aladdin
170;Skin And Bones;Franklin W. Dixon;2000;Aladdin
171;LAW OF THE JUNGLE (HARDY BOYS CASE FILE 105) : LAW OF THE JUNGLE (Hardy Boys, The);Franklin W. Dixon;1995;Simon Pulse
172;The Cat Who Came to Breakfast (Cat Who... (Hardcover));Lilian Jackson Braun;1994;Putnam Pub Group
173;If Singleness Is a Gift, What's the Return Policy?;Holly Virden;2003;Nelson Books
174;Always Daddy's Girl: Understanding Your Father's Impact on Who You Are;H. Norman Wright;1989;Regal Books
175;Night Mare (Xanth Novels (Paperback));Piers Anthony;1990;Del Rey Books
176;The Martian Chronicles;RAY BRADBURY;1984;Spectra
177;Kabale Und Liebe;Schiller;0;Philipp Reclam, Jun Verlag GmbH
178;Der illustrierte Mann. Erz√?¬§hlungen.;Ray Bradbury;2002;Diogenes
179;Der K√?¬∂nig in Gelb.;Raymond Chandler;1980;Diogenes Verlag
180;Fahrenheit 451;Ray Bradbury;1994;Distribooks Inc
181;Die Mars- Chroniken. Roman in Erz√?¬§hlungen.;Ray Bradbury;1981;Diogenes Verlag
182;Das B√?¬∂se kommt auf leisen Sohlen.;Ray Bradbury;2003;Diogenes
183;L√?¬∂wenzahnwein. Roman.;Ray Bradbury;1999;Diogenes Verlag
184;Das Kind von morgen. Erz√?¬§hlungen.;Ray Bradbury;2000;Diogenes Verlag
185;Die Mechanismen der Freude. Erz√?¬§hlungen.;Ray Bradbury;2000;Diogenes Verlag
186;Familientreffen. Erz√?¬§hlungen.;Ray Bradbury;2000;Diogenes Verlag
187;Der Tod kommt schnell in Mexico. Erz√?¬§hlungen.;Ray Bradbury;1988;Diogenes Verlag
188;Veronika Deschliesst Zu Sterben / Vernika Decides to Die;Paolo Coelho;2002;Distribooks
189;Die Liebe in Den Zelten;Gabriel Garcia Marquez;0;Deutscher Taschenbuch Verlag (DTV)
190;Die Klone der Joanna May. Roman.;Fay Weldon;1993;Dtv
191;Ist mein Hintern wirklich so dick? Tagebuch einer empfindsamen Frau.;Arabella Weir;1998;Dtv
192;Haifischfrauen.;Kiana Davenport;1996;Droemersche Verlagsanstalt Th. Knaur Nachf., GmbH  Co.
193;Die Cappuccino- Jahre. Aus dem Tagebuch des Adrian Mole.;Sue Townsend;2002;Heyne
194;Schwarzer Tee mit drei St√ºck Zucker;Renan Demirkan;1991;Kiepenheuer  Witsch
195;Quersch√?¬ºsse - Downsize This!;Michael Moore;2003;Piper
196;Die Korrekturen.;Jonathan Franzen;2002;Rowohlt, Reinbek
197;Neun Erz√?¬§hlungen.;Jerome D. Salinger;1968;Rowohlt Tb.
198;Hebt den Dachbalken hoch, Zimmerleute / Seymour wird vorgestellt.;Jerome D. Salinger;1998;Rowohlt Tb.
199;Ulysses (√?¬?bersetzg. Wollschl√?¬§ger). ( Neue Folge, 100).;James Joyce;1981;Suhrkamp
200;Eine ganz normale Aff√?¬§re.;Joanna Trollope;2002;Ullstein Tb
201;Das Intimleben des Adrian Mole, 13 3/4 Jahre. cbt. ( Ab 14 J.).;Sue Townsend;2002;Bertelsmann, M√?¬ºnchen
202;Das Buch der l√?¬§cherlichen Liebe.;Milan Kundera;2000;Fischer (Tb.), Frankfurt
203;The God of Small Things;Arundhati Roy;1998;Perennial
204;The James Dean Affair: A Neil Gulliver  Stevie Marriner Novel;Robert S. Levinson;2000;St Martins Pr
205;The Big Bad Wolf: A Novel;James Patterson;2003;Little, Brown
206;Four Blind Mice;James Patterson;2002;Little, Brown
207;Private Screening;Richard North Patterson;1994;Ballantine Books
208;Congo;Michael Crichton;1995;Ballantine Books
209;Protect and Defend;Richard North Patterson;2001;Ballantine Books
210;The Tall Pine Polka;Lorna Landvik;1999;Ballantine Books
211;Memoirs of a Geisha;Arthur Golden;1997;Alfred A. Knopf
212;Plainsong (Vintage Contemporaries);KENT HARUF;2000;Vintage
213;Body of Evidence (Kay Scarpetta Mysteries (Paperback));Patricia D. Cornwell;1992;Avon
214;All That Remains (Kay Scarpetta Mysteries (Paperback));Patricia D. Cornwell;1993;Avon
215;The Case of the Lost Look-Alike (An Avon Camelot Book);Carol J. Farley;1988;Avon Books
216;Petals on the River;Kathleen E. Woodiwiss;1997;Avon Trade
217;The Elusive Flame;Kathleen E. Woodiwiss;1999;Avon
218;Legacy of Silence;Belva Plain;1998;Bantam Dell Pub Group
219;The Brethren;JOHN GRISHAM;2000;Doubleday
220;The King of Torts;John Grisham;2003;Doubleday Books
221;The Curious Incident of the Dog in the Night-Time : A Novel;MARK HADDON;2003;Doubleday
222;Bleachers;John Grisham;2003;Doubleday
223;Sisterhood of the Traveling Pants;ANN BRASHARES;2003;Delacorte Books for Young Readers
224;Only Love (Magical Love);Erich Segal;1998;Berkley Publishing Group
225;All or Nothing (Wheeler Large Print Books);Elizabeth Adler;2000;Island
226;Roses Are Red (Alex Cross Novels);James Patterson;2001;Warner Vision
227;The Rescue;Nicholas Sparks;2001;Warner Books
228;Manhattan Hunt Club;JOHN SAUL;2002;Ballantine Books
229;Patty Jane's House of Curl (Ballantine Reader's Circle);LORNA LANDVIK;1996;Ballantine Books
230;Pet Sematary;Stephen King;1994;Signet Book
231;Silent Snow;Steve Thayer;2000;Signet Book
232;Girl with a Pearl Earring;Tracy Chevalier;2001;Plume Books
233;Summer of Storms;Judith Kelman;2002;Jove Books
234;The Patient;Michael Palmer;2001;Bantam Books
235;Demona's Revenge (Gargoyles, No. 2);Francine Hughes;1995;Scholastic
236;Clifford's Sports Day;Norman Bridwell;1996;Scholastic
237;Postmortem (Kay Scarpetta Mysteries (Paperback));Patricia Cornwell;1998;Pocket
238;Deception Point;Dan Brown;2002;Pocket
239;Tis : A Memoir;Frank McCourt;1999;Scribner
240;Angels  Demons;Dan Brown;2003;Atria
241;A Monk Swimming;Malachy McCourt;1998;Hyperion
242;Crazy Horse;Mari Sandoz;1961;University of Nebraska Press
243;The Silent Cry (William Monk Novels (Paperback));Anne Perry;1998;Ivy Books
244;The Kalahari Typing School for Men (No. 1 Ladies' Detective Agency);ALEXANDER MCCALL SMITH;2004;Anchor
245;Chicken Soup for the Soul (Chicken Soup for the Soul);Jack Canfield;1993;Health Communications
246;Wicked: The Life and Times of the Wicked Witch of the West;Gregory Maguire;1996;Regan Books
247;Life of Pi;Yann Martel;2002;Harcourt
248;A Judgement in Stone;Ruth Rendell;2000;Vintage Books USA
249;Lies and the Lying Liars Who Tell Them: A Fair and Balanced Look at the Right;Al Franken;2003;Dutton Books
250;Secret History;DONNA TARTT;1993;Ballantine Books
251;Chicken Soup for the Woman's Soul (Chicken Soup for the Soul Series (Paper));Jack Canfield;1996;Health Communications
252;Great Expectations (Heinemann Guided Readers);John Milne;1995;Delta Systems
253;The Weight of Water;Anita Shreve;2001;Little, Brown
254;Moving Pictures (Discworld Novels (Paperback));Terry Pratchett;2002;HarperTorch
255;Night Watch;Terry Pratchett;2002;HarperCollins
256;Thief of Time;Terry Pratchett;2001;HarperCollins Publishers
257;Charlotte's Web Book and Charm (Charming Classics);E. B. White;2003;HarperFestival
258;Peter Pan: The Original Story (Peter Pan);J. M. Barrie;2003;HarperFestival
259;My Friend Flicka;Mary O'Hara;1988;Perennial
260;The Last Hero : A Discworld Fable (Discworld Novels (Hardcover));Terry Pratchett;2001;HarperCollins
261;Jingo: A Discworld Novel (Discworld Series/Terry Pratchett);Terry Pratchett;1998;HarperPrism
262;Maskerade: A Novel of Discworld (Pratchett, Terry. Discworld Series (New York, N.Y.).);Terry Pratchett;1997;HarperPrism
263;Interesting Times: A Novel of Discworld;Terry Pratchett;1997;Harpercollins
264;On the Bright Side, I'm Now the Girlfriend of a Sex God: Further Confessions of Georgia Nicolson;Louise Rennison;2002;HarperTempest
265;Mansfield Park (Penguin Popular Classics);Jane Austen;1994;Penguin Books Ltd
266;The Wind in the Willows;Kenneth Grahame;1996;St. Martin's Press
267;The Winter King: A Novel of Arthur (The Warlord Chronicles: I);Bernard Cornwell;1997;St. Martin's Griffin
268;Moonheart (Newford);Charles de Lint;1994;Orb Books
269;The King of Elfland's Daughter (Del Rey Impact);Edward John Moreton Drax Plunkett Dunsany;1999;Del Rey Books
270;Powder and Patch;Georgette Heyer;2004;Harlequin
271;The Picture of Dorian Gray (Modern Library (Paperback));OSCAR WILDE;1998;Modern Library
272;The Iron Giant;Ted Hughes;1999;Knopf Books for Young Readers
273;James and the Giant Peach;ROALD DAHL;2002;Knopf Books for Young Readers
274;The Amber Spyglass (His Dark Materials, Book 3);PHILIP PULLMAN;2002;Knopf Books for Young Readers
275;The Golden Compass (His Dark Materials, Book 1);PHILIP PULLMAN;2002;Knopf Books for Young Readers
276;The Subtle Knife (His Dark Materials, Book 2);PHILIP PULLMAN;2002;Knopf Books for Young Readers
277;The Adrian Mole Diaries : The Secret Diary of Adrian Mole, Aged 13 3/4 : The Growing Pains of Adrian Mole;Sue Townsend;1997;Perennial
278;Martian Chronicles;Ray Bradbury;1997;William Morrow
279;The Great God Pan;Donna Jo Napoli;2003;Wendy Lamb Books
280;Possession: A Romance;A. S. Byatt;1990;Random House Inc
281;Born Confused;Tanuja Desai Hidier;2003;Push
282;Confessions of a Shopaholic;SOPHIE KINSELLA;2003;Dell
283;Making Minty Malone;Isabel Wolff;2000;Onyx Books
284;Little Women (Signet Classic);Louisa May Alcott;1988;Signet Classics
285;Emma (Signet Classics (Paperback));Jane Austen;1996;Signet Classics
286;Animal Farm;George Orwell;2004;Signet
287;Great Expectations (Dover Thrift Editions);Charles Dickens;2001;Dover Publications
288;Eva Luna;Isabel Allende;1989;Bantam Books
289;Poisonwood Bible Edition Uk;Barbara Kingsolver;0;Faber Faber Inc
290;The Green Man : Tales from the Mythic Forest;Ellen Datlow;2002;Viking Juvenile
291;Nicholas Nickleby (Everyman's Library);Charles Dickens;1993;Alfred A. Knopf
292;Angels  Insects : Two Novellas;A.S. BYATT;1994;Vintage
293;Catch 22;Joseph Heller;1996;Simon  Schuster
294;The Forsyte Saga : The Man of Property and In Chancery;John Galsworthy;2002;Touchstone
295;The Enchanted Wood;Enid Blyton;2002;Egmont Childrens Books
296;The Folk of the Faraway Tree;Enid Blyton;2002;Egmont Childrens Books
297;Angels and Visitations: A Miscellany;Neil Gaiman;1993;Dreamhaven Books
298;League of Extraordinary Gentlemen, Vol. 2 (Comic);Alan Moore;2003;DC Comics
299;Preludes and Nocturnes (Sandman, Book 1);Neil Gaiman;1998;DC Comics
300;The League of Extraordinary Gentlemen, Vol. 1;Alan Moore;2002;DC Comics
301;Harlequin Valentine;Neil Gaiman;2002;Dark Horse Comics
302;Alpha Teach Yourself American Sign Language in 24 Hours (Alpha Teach Yourself in 24 Hours);Trudy Suggs;2003;Alpha Books
303;A Man in Full;Tom Wolfe;1998;Farrar Straus  Giroux
304;The Miracle Life of Edgar Mint: A Novel;Brady Udall;2002;Vintage Books USA
305;October Sky: A Memoir;Homer Hickam;1999;Dell
306;A Painted House;John Grisham;2001;Dell Publishing Company
307;The Romance Reader;Pearl Abraham;1996;Riverhead Books
308;Far from the Madding Crowd (Wordsworth Classics);Thomas Hardy;1997;NTC/Contemporary Publishing Company
309;The Perfect Storm : A True Story of Men Against the Sea;Sebastian Junger;1999;Perennial
310;The Battle for God;Karen Armstrong;2001;Ballantine Books
311;Sappho: A New Translation;Mary Barnard;1958;University of California Press
312;The Postman (Bantam Classics);David Brin;1990;Spectra Books
313;The Tortilla Curtain;T. Coraghessan Boyle;1995;Viking Books
314;Symposium;Paul Woodruff;1989;Hackett Pub Co Inc
315;The What's Happening to My Body? Book for Boys: A Growing Up Guide for Parents and Sons;Lynda Madaras;1987;W W Norton  Co
316;OBJECT AFFECTION;Stephen McCauley;1988;Washington Square Press
317;The Journey Home;Isabelle Holland;1993;Scholastic Paperbacks (Mm)
318;Taking the Ferry Home;Pam Conrad;1990;Harpercollins Juvenile Books
319;Angel of Hope (Mercy Trilogy);Lurlene McDaniel;2000;Starfire
320;The Breach;Brian Kaufman;2002;Last Knight Pub Co
321;Neanderthal: A Novel;John Darnton;1997;St. Martin's Press
322;A Small Dark Place;Martin Schenk;1999;Ballantine Books
323;The Rivan Codex : Ancient Texts of THE BELGARIAD and THE MALLOREON;DAVID EDDINGS;1999;Del Rey
324;Babyhood;Paul Reiser;1998;Avon
325;Year's Best Fantasy (Year's Best Fantasy);David G. Hartwell;2001;Eos
326;Dave Barry in Cyberspace;Dave Barry;1997;Ballantine Books
327;Wolf Moon;John R. Holt;1997;Bantam
328;The War in Heaven (Eternal Warriors);Theodore Beale;2000;Pocket
329;Waiting;Frank M. Robinson;2000;Tor Books
330;Nowhere To Run;Mary Jane Clark;2004;St. Martin's Paperbacks
331;Frankenstein (Dover Thrift Editions);Mary Wollstonecraft Shelley;1994;Dover Publications
332;El gust amarg de la cervesa (Collecci√≥ Cl√†ssica);Isabel-Clara Sim√≥;1999;Columna
333;Urn Burial;Robert Westall;1987;Viking Children's Books
334;All Our Yesterdays (Large Print);Robert B. Parker;1994;Delacorte Press
335;What Shall I Be (Barbie Carryalong);Rita Chapman Works;1999;Reader's Digest
336;ALL THAT REMAINS;Patricia Cornwell;1992;Scribner
337;Last Chance to See;Douglas Adams;1992;Ballantine Books
338;Vinegar Hill (Oprah's Book Club (Paperback));A. Manette Ansay;1998;Perennial
339;Affinity;Sarah Waters;2002;Riverhead Books
340;Diario de Ana Frank;Anne Frank;2000;Editores Mexicanos Unidos, S.A.
341;Desert Notes/River Notes;Barry Lopez;1990;Quill (HarperCollins)
342;The Best Democracy Money Can Buy: The Truth About Corporate Cons, Globalization and High-Finance Fraudsters;Greg Palast;2003;Plume Books
343;The Hunt for Red October;Tom Clancy;1990;Berkley Publishing Group
344;The Music Box;Andrea Kane;1998;Pocket
345;Liberty Falling (Anna Pigeon Mysteries (Paperback));Nevada Barr;2000;Avon
346;El Palacio de La Luna;Paul Auster;1996;Anagrama
347;Mientras Escribo;Stephen King;2002;Distribooks
348;Killer Market (Deborah Knott Mysteries (Paperback));Margaret Maron;1999;Warner Books
349;Remembering Peter Gzowski : A Book of Tributes;EDNA BARKER;2002;Douglas Gibson Books
350;The Best Canadian Animal Stories: Classic Tales by Master Storytellers;Muriel Whitaker;1997;McClelland  Stewart
351;Trying to Save Piggy Sneed;John Irving;1996;Arcade Publishing
352;Herr Der Fliegen (Fiction, Poetry and Drama);Golding;0;Fischer Taschenbuch Verlag GmbH
353;Seattle Access;HarperReference;1993;Access Press (HarperCollins)
